{
  "$schema": "../schemas/publication-privacy.schema.json",
  "schema": "hyperflux-publication-privacy-v1",
  "scope": {
    "tracked_and_unignored_files_only": true,
    "paths_scanned": true,
    "utf8_text_scanned": true,
    "binary_payloads_ascii_scanned": true,
    "maximum_text_file_bytes": 33554432
  },
  "normalization": {
    "unicode_casefold": true,
    "non_alphanumeric_separator": true,
    "maximum_words_per_term": 4
  },
  "forbidden_term_sha256": [
    {"id": "private-term-01", "word_count": 1, "sha256": "57de4cf40144bdf7d00010f2f5557a7d642c2b9705309bfade167dd313e2ca93"},
    {"id": "private-term-02", "word_count": 1, "sha256": "60965168ce762e949600281ba6d01fee136e5b6e8257b1f216f9025ed324474c"},
    {"id": "private-term-03", "word_count": 2, "sha256": "ea198c98bbb82c6d3163194fac6132c3f41a95e1be9235cab986980f5ba04253"},
    {"id": "private-term-04", "word_count": 1, "sha256": "7d3194f79e645c42e4396dda38be04766810ec6a00d00aced3ffc2a0a1f1a9ef"},
    {"id": "private-term-05", "word_count": 2, "sha256": "f3ed9ee201ce50b5961e91b689cad0460a7c48848f7954f6dc96be2d1e435816"},
    {"id": "private-term-06", "word_count": 1, "sha256": "6f7ac1823da81d2e52d1a1549ee69c85bbf8bb56d06682849e7c09da2785ce3b"},
    {"id": "private-term-07", "word_count": 2, "sha256": "6faef1df454754cb29df4e7e91bf6e37f64060ba852cb61d9f201f7b2a96b6bc"},
    {"id": "private-term-08", "word_count": 1, "sha256": "3ea125d0bff386e6754b3782b300016fc79a9cf8f8669c0a5c3db64467ddb681"},
    {"id": "private-term-09", "word_count": 2, "sha256": "7611978a2cdeb3ed971114a18ec70d373a37e428f4100f0a977697bc4cde9aba"},
    {"id": "private-term-10", "word_count": 2, "sha256": "cdcbb68a3444fdd629ab0af770af3fc99e4d5dde43b576d5f855691e155283ec"},
    {"id": "private-term-11", "word_count": 2, "sha256": "0677069fdf937bd1e36cb0f16701b00ee98436d5638157bae9d36f602ad62aba"},
    {"id": "private-term-12", "word_count": 2, "sha256": "644efa71426c29fe8041167f180146406e7c28eb0d42094ddd8287ffbae7f8bc"},
    {"id": "private-term-13", "word_count": 2, "sha256": "803b3eb2b6af027151950019f2d5ede506a6636a9eafd262b27c23e3f834056f"},
    {"id": "private-term-14", "word_count": 2, "sha256": "7dd9d5f010e8a9a74e0d40763f82735105cdac542ed9b1cf493498d650af161e"},
    {"id": "private-term-15", "word_count": 3, "sha256": "9c26adb26ee86916ba8aaa7944adeb4ae19e099344af4f923537054650672579"},
    {"id": "private-term-16", "word_count": 2, "sha256": "5eff592cc497fccb48ebfffaca38a83f9167bc1661b4477e1fc1b66b658cd5a0"},
    {"id": "private-term-17", "word_count": 1, "sha256": "487b91042c7cf27a19e23ea8699f5f354b1a0c3af9e418138dc6150d830f970d"},
    {"id": "private-term-18", "word_count": 2, "sha256": "2d333f8f9bda4688794a73a1fbbf57732f4720b88330d46568188e8a63cb3e0e"},
    {"id": "private-term-19", "word_count": 2, "sha256": "da4b6f14cdf8e14e84655e1e96b3c44a591be3601b293fdea6e9aad76290dea3"}
  ],
  "allowed_protocol_notation": {
    "tokens": ["ai"],
    "reason": "D-Bus and OpenRazer signature notation is protocol data, not authorship metadata."
  }
}
